{
  "$schema": "./schema/tokens.schema.json",
  "version": "1.0.0",
  "generated": "2026-04-26",
  "generatedBy": "claude/ui-prototype-route-inventory",
  "sources": {
    "prototype": "docs/design/claude-export/design-system/tokens.css",
    "webRuntime": "apps/web/app/globals.css",
    "tsConstants": "packages/ui/src/theme/tokens.ts"
  },
  "statusLegend": {
    "missing": "no implementation in repo",
    "ported": "value present in CSS / TS constants",
    "diverges": "ported but value drifts from prototype source",
    "shipped": "stable + production-verified"
  },
  "groups": {
    "corePalette": {
      "owner": "claude-ui-pkg",
      "tokens": [
        { "name": "ink", "value": "#131312", "cssVar": "--color-ink", "tsKey": "ink", "status": "ported" },
        { "name": "cream", "value": "#F3EBE2", "cssVar": "--color-cream", "tsKey": "cream", "status": "ported" },
        { "name": "cream-raised", "value": "#FAF6F0", "cssVar": "--color-cream-raised", "tsKey": "creamRaised", "status": "ported" },
        { "name": "cream-deep", "value": "#EBE0D2", "cssVar": "--color-cream-deep", "tsKey": "creamDeep", "status": "ported" },
        { "name": "tempo-orange", "value": "#D97757", "cssVar": "--color-tempo-orange", "tsKey": "tempoOrange", "status": "ported" },
        { "name": "soft-orange", "value": "#E8A87C", "cssVar": "--color-soft-orange", "tsKey": "softOrange", "status": "ported" },
        { "name": "dust-grey", "value": "#6B6864", "cssVar": "--color-dust-grey", "tsKey": "dustGrey", "status": "ported" },
        { "name": "dust-grey-soft", "value": "#9A968F", "cssVar": "--color-dust-grey-soft", "tsKey": "dustGreySoft", "status": "ported" },
        { "name": "line", "value": "#D7CEC2", "cssVar": "--color-line", "tsKey": "line", "status": "ported" },
        { "name": "line-soft", "value": "#E6DDD1", "cssVar": "--color-line-soft", "tsKey": "lineSoft", "status": "ported" }
      ]
    },
    "semanticStatus": {
      "owner": "claude-ui-pkg",
      "notes": "Each status color pairs with an icon or label per HARD_RULES §7.1 (color-blind safety).",
      "tokens": [
        { "name": "moss", "value": "#4A7C59", "cssVar": "--color-moss", "tsKey": "moss", "status": "ported" },
        { "name": "moss-bg", "value": "rgba(74, 124, 89, 0.10)", "cssVar": "(absent in globals.css)", "status": "missing", "notes": "Not yet exported into globals.css — only the solid color is in web." },
        { "name": "brick", "value": "#C8553D", "cssVar": "--color-brick", "tsKey": "brick", "status": "ported" },
        { "name": "brick-bg", "value": "rgba(200, 85, 61, 0.10)", "cssVar": "(absent)", "status": "missing" },
        { "name": "amber", "value": "#D4A44C", "cssVar": "--color-amber", "tsKey": "amber", "status": "ported" },
        { "name": "amber-bg", "value": "rgba(212, 164, 76, 0.14)", "cssVar": "(absent)", "status": "missing" },
        { "name": "slate-blue", "value": "#6E88A7", "cssVar": "--color-slate-blue", "tsKey": "slateBlue", "status": "ported" },
        { "name": "slate-blue-bg", "value": "rgba(110, 136, 167, 0.12)", "cssVar": "(absent)", "status": "missing" }
      ]
    },
    "surfaces": {
      "owner": "claude-ui-pkg",
      "tokens": [
        { "name": "surface-page", "value": "var(--cream)", "cssVar": "--color-background", "status": "ported" },
        { "name": "surface-card", "value": "var(--cream-raised)", "cssVar": "--color-card", "status": "ported" },
        { "name": "surface-sunken", "value": "var(--cream-deep)", "cssVar": "--color-surface-sunken", "status": "ported" },
        { "name": "surface-inverse", "value": "var(--ink)", "cssVar": "--color-surface-inverse", "status": "ported" }
      ]
    },
    "marketingDarkSurfaces": {
      "owner": "claude-web-marketing",
      "notes": "Used on marketing dark strips (landing.html). Light-mode dark, not the app dark theme.",
      "tokens": [
        { "name": "mkt-dark-bg", "value": "#1E1D1B", "cssVar": "--color-mkt-dark-bg", "status": "ported" },
        { "name": "mkt-dark-bg-2", "value": "#2A2826", "cssVar": "--color-mkt-dark-bg-2", "status": "ported" },
        { "name": "mkt-dark-fg", "value": "#F7F0E8", "cssVar": "--color-mkt-dark-fg", "status": "ported" },
        { "name": "mkt-dark-fg-muted", "value": "rgba(247,240,232,0.75)", "cssVar": "--color-mkt-dark-fg-muted", "status": "ported" },
        { "name": "mkt-dark-fg-subtle", "value": "rgba(247,240,232,0.55)", "cssVar": "--color-mkt-dark-fg-subtle", "status": "ported" },
        { "name": "mkt-dark-border", "value": "rgba(247,240,232,0.12)", "cssVar": "--color-mkt-dark-border", "status": "ported" },
        { "name": "mkt-dark-bubble", "value": "rgba(247,240,232,0.06)", "cssVar": "--color-mkt-dark-bubble", "status": "ported" },
        { "name": "mkt-feat-warm", "value": "linear-gradient(145deg, #F5EADF 0%, #EBD9C7 100%)", "cssVar": "(absent)", "status": "missing" }
      ]
    },
    "gradients": {
      "owner": "claude-ui-pkg",
      "tokens": [
        { "name": "gradient-tempo", "value": "linear-gradient(135deg, var(--tempo-orange) 0%, var(--soft-orange) 100%)", "cssVar": "(insufficient evidence — verify utility class)", "status": "missing", "notes": "Used by .tempo-gradient and .tempo-gradient-text utility classes in tokens.css. Check if these landed in globals.css." }
      ]
    },
    "typography": {
      "owner": "claude-ui-pkg",
      "tokens": [
        { "name": "font-serif", "value": "Newsreader", "cssVar": "--font-serif", "tsKey": "serif", "status": "ported" },
        { "name": "font-sans", "value": "Inter", "cssVar": "--font-sans", "tsKey": "sans", "status": "ported" },
        { "name": "font-mono", "value": "IBM Plex Mono", "cssVar": "--font-mono", "tsKey": "mono", "status": "ported" },
        { "name": "font-dyslexia", "value": "OpenDyslexic", "cssVar": "[data-dyslexia=on] override", "tsKey": "dyslexia", "status": "ported" },
        { "name": "size-display", "value": "56px", "cssVar": "--text-display", "status": "ported" },
        { "name": "size-h1", "value": "32px", "cssVar": "--text-h1", "status": "ported" },
        { "name": "size-h2", "value": "24px", "cssVar": "--text-h2", "status": "ported" },
        { "name": "size-h3", "value": "20px", "cssVar": "--text-h3", "status": "ported" },
        { "name": "size-body", "value": "16px", "cssVar": "--text-body", "status": "ported" },
        { "name": "size-small", "value": "14px", "cssVar": "--text-small", "status": "ported" },
        { "name": "size-caption", "value": "12px", "cssVar": "--text-caption", "status": "ported" },
        { "name": "leading-display", "value": "1.15", "cssVar": "(insufficient evidence)", "status": "missing" },
        { "name": "leading-heading", "value": "1.2", "cssVar": "(insufficient evidence)", "status": "missing" },
        { "name": "leading-body", "value": "1.5", "cssVar": "(insufficient evidence)", "status": "missing" },
        { "name": "tracking-display", "value": "-0.02em", "cssVar": "(insufficient evidence)", "status": "missing" },
        { "name": "tracking-eyebrow", "value": "0.08em", "cssVar": "(insufficient evidence)", "status": "missing" }
      ]
    },
    "spacing": {
      "owner": "claude-ui-pkg",
      "notes": "8-pt grid. Tailwind v4 uses --spacing as base unit; these are the design-system stops.",
      "tokens": [
        { "name": "space-1", "value": "4px", "cssVar": "--spacing", "tsKey": "1", "status": "ported" },
        { "name": "space-2", "value": "8px", "tsKey": "2", "status": "ported" },
        { "name": "space-3", "value": "12px", "tsKey": "3", "status": "ported" },
        { "name": "space-4", "value": "16px", "tsKey": "4", "status": "ported" },
        { "name": "space-5", "value": "20px", "tsKey": "5", "status": "ported" },
        { "name": "space-6", "value": "24px", "tsKey": "6", "status": "ported" },
        { "name": "space-8", "value": "32px", "tsKey": "8", "status": "ported" },
        { "name": "space-10", "value": "40px", "tsKey": "10", "status": "ported" },
        { "name": "space-12", "value": "48px", "tsKey": "12", "status": "ported" },
        { "name": "space-16", "value": "64px", "tsKey": "16", "status": "ported" },
        { "name": "space-20", "value": "80px", "tsKey": "20", "status": "ported" },
        { "name": "space-24", "value": "96px", "tsKey": "24", "status": "ported" }
      ]
    },
    "radii": {
      "owner": "claude-ui-pkg",
      "tokens": [
        { "name": "radius-sm", "value": "4px", "cssVar": "--radius-sm", "tsKey": "sm", "status": "ported" },
        { "name": "radius", "value": "8px", "cssVar": "--radius", "tsKey": "base", "status": "ported" },
        { "name": "radius-md", "value": "10px", "cssVar": "--radius-md", "tsKey": "md", "status": "ported" },
        { "name": "radius-lg", "value": "12px", "cssVar": "--radius-lg", "tsKey": "lg", "status": "ported" },
        { "name": "radius-xl", "value": "16px", "cssVar": "--radius-xl", "tsKey": "xl", "status": "ported" },
        { "name": "radius-2xl", "value": "24px", "cssVar": "(verify)", "tsKey": "2xl", "status": "ported" },
        { "name": "radius-pill", "value": "9999px", "cssVar": "(verify)", "tsKey": "pill", "status": "ported" }
      ]
    },
    "shadows": {
      "owner": "claude-ui-pkg",
      "notes": "Per Brand Identity v1: extreme restraint on shadows.",
      "tokens": [
        { "name": "shadow-whisper", "value": "0 1px 1px 0 rgba(19,19,18,0.04)", "cssVar": "(verify)", "status": "missing" },
        { "name": "shadow-card", "value": "0 1px 2px 0 rgba(19,19,18,0.05), 0 0 0 1px rgba(19,19,18,0.04)", "cssVar": "(verify)", "status": "missing" },
        { "name": "shadow-lift", "value": "0 6px 16px -8px rgba(19,19,18,0.10), 0 0 0 1px rgba(19,19,18,0.04)", "cssVar": "(verify)", "status": "missing" },
        { "name": "shadow-modal", "value": "0 30px 60px -30px rgba(19,19,18,0.35)", "cssVar": "(verify)", "status": "missing" }
      ]
    },
    "motion": {
      "owner": "claude-ui-pkg",
      "tokens": [